{
  "$schema": "./documentation-system-catalog.schema.json",
  "schemaVersion": 1,
  "status": "PROPOSED",
  "inventoryEvidence": {
    "normalizedSha256": "sha256:b877e8a0f5498c4b19662ca9ae84aed556c1e80f2e338f7d02ed0e597f87b133",
    "recordCount": 34,
    "repositoryCount": 5,
    "documentationFamilyCount": 11,
    "sourceSurfaceCount": 4,
    "gaps": ["gap:kubernetes:platform-deployment-contract"]
  },
  "repositories": [
    { "repository": "AquilaXk/easysubway", "status": "PROPOSED", "fragment": null },
    { "repository": "AquilaXk/easysubway-backend", "status": "PROPOSED", "fragment": null },
    { "repository": "AquilaXk/easysubway-data", "status": "PROPOSED", "fragment": null },
    {
      "repository": "AquilaXk/easysubway-mobile",
      "status": "ACTIVE",
      "fragment": {
        "gitSha": "397a475a988c65fb31600142d5c79f26e46a03f5",
        "path": "contracts/documentation/documentation-fragment.json",
        "blobSha": "37aa755bf7959737dc68a10ff346f16b5bc1954b",
        "lastVerifiedAt": "2026-08-13T07:33:23.000Z",
        "verificationEvidence": [
          "https://github.com/AquilaXk/easysubway-mobile/issues/225",
          "https://github.com/AquilaXk/easysubway/pull/2854"
        ]
      }
    },
    { "repository": "AquilaXk/easysubway-platform", "status": "PROPOSED", "fragment": null }
  ]
}
